Name,ExternalId__c,Description__c,WhenToUse__c,InstructionBody__c,Status__c,Version__c,Locale__c
workflow-support-case-lifecycle,workflow-support-case-lifecycle:v1:en-US,"Standard case lifecycle workflow.","Use when opening, updating, or closing customer support cases.","Step 1: Verify user identity. Step 2: Capture issue summary, severity, and business impact. Step 3: Create or update support case. Step 4: Confirm case number and ETA. Step 5: Summarize agreed next actions.",active,v1,en-US
workflow-escalate-to-human,workflow-escalate-to-human:v1:en-US,"Escalation workflow for unresolved issues or explicit handoff requests.","Use when troubleshooting does not resolve issue, user requests human, or policy requires escalation.","Step 1: Summarize issue, attempted steps, and current status. Step 2: Route to human queue with priority and contact details. Step 3: Provide user confirmation with case or handoff reference.",active,v1,en-US
workflow-troubleshooting-wifi-modem,workflow-troubleshooting-wifi-modem:v1:en-US,"Troubleshoot Wi-Fi modem connectivity issues.","Use when user has internet outage, unstable Wi-Fi, or modem light issues.","Collect modem model and LED status. Guide power cycle, cable checks, signal verification. Escalate if unresolved.",active,v1,en-US
workflow-troubleshooting-5g-modem,workflow-troubleshooting-5g-modem:v1:en-US,"Troubleshoot 5G modem signal and throughput issues.","Use when 5G modem has low signal or unstable service.","Capture location, signal bars, firmware. Guide placement optimization and network refresh. Escalate if throughput below threshold.",active,v1,en-US
workflow-troubleshooting-iphone-16,workflow-troubleshooting-iphone-16:v1:en-US,"Troubleshoot iPhone 16 device issues.","Use for iPhone 16 configuration, connectivity, or app behavior support.","Validate iOS version and affected feature. Guide settings reset and network diagnostics. Escalate if issue persists.",active,v1,en-US
workflow-troubleshooting-iphone-16-pro,workflow-troubleshooting-iphone-16-pro:v1:en-US,"Troubleshoot iPhone 16 Pro device issues.","Use for iPhone 16 Pro technical issues.","Gather updates and reproducible scenario. Guide ProMotion, camera, and performance remediation. Escalate for unresolved defects.",active,v1,en-US
workflow-troubleshooting-galaxy-s25,workflow-troubleshooting-galaxy-s25:v1:en-US,"Troubleshoot Samsung Galaxy S25 device issues.","Use for Galaxy S25 network, battery, and app-related issues.","Collect One UI version and recent changes. Run diagnostics and standard reset path. Escalate with detailed summary when unresolved.",active,v1,en-US
workflow-troubleshooting-galaxy-s25-ultra,workflow-troubleshooting-galaxy-s25-ultra:v1:en-US,"Troubleshoot Samsung Galaxy S25 Ultra device issues.","Use for Galaxy S25 Ultra camera, connectivity, and performance issues.","Capture exact symptom and scenario. Guide corrective steps. Escalate for specialist support when needed.",active,v1,en-US
